sigla,instituicao,ror,works,citacoes,h_index,i10,mean_citedness,oa_share,cit_por_trabalho
UFTM,Universidade Federal do Triângulo Mineiro,01av3m334,12817,249539,126,6752,0.891,0.776,19.47
UFU,Universidade Federal de Uberlândia,04x3wvr31,49664,1097814,224,27260,1.283,0.6891,22.1
UFMG,Universidade Federal de Minas Gerais,0176yjw32,140796,5801735,492,121665,1.691,0.638,41.21
UFV,Universidade Federal de Viçosa,0409dgb37,57161,2049233,302,51038,1.622,0.7151,35.85
UFJF,Universidade Federal de Juiz de Fora,04yqw9c44,38230,1046492,276,21233,1.137,0.7083,27.37
UFSJ,Federal University of São João del-Rei,03vrj4p82,15193,398491,207,8510,1.194,0.6935,26.23
